Name,English,Translation,Restrictions,Comment
RoomEditor_ConfirmDeleteParentLayers,Attempting to delete layers from a parent room (Note: Instance creation code will be irrevocably lost).\nDelete All: Delete matching layers from child rooms\nKeep All: Keep all child room layers\nKeep Changed: Keep child room layers which have overridden the parent\nImmediate Children: {0},尝试从父房间里删除层（注:创建实例的代码将会不可挽回的失去）.\n删除全部:删除子房间的匹配的层\n保持全部:保持所有子房间的层不变\n保持更改:保持子房间其中重写父房间的层不变\n直系子房间: {0},,layer delete confirm dialog message explaining the child layer deletion options
RoomEditor_DeleteAllChildLayers,Delete All,删除全部,,layer delete confirm dialog message for the delete all button
RoomEditor_DeleteLayer,Delete Layer,删除层,,context menu option for deleting a layer
RoomEditor_RenameLayer,Rename Layer,重命名层,,context menu option for renaming a layer
RoomEditor_DeleteSelectedLayer,Delete Selected Layers,删除选中的层,,tooltip for the delete selected layers button
RoomEditor_GraphicProperties,Graphic: {0},图像: {0},,graphic properties window 
RoomEditor_GridColour,Colour:,颜色:,,room editor toolbar grid colour select button caption
RoomEditor_GridSnapX,Snap X:,吸附 X:,,room editor toolbar grid horizontal snap numeric textbox caption
RoomEditor_GridSnapY,Snap Y:,吸附 Y:,,room editor toolbar grid vertical snap numeric textbox caption
RoomEditor_Inherit,Inherit,继承,,Inherit button caption
RoomEditor_InheritCode,Inherit Creation Code,继承创建时代码,,Tooltip for the button which sets if this room inherits its creation code from the parent
RoomEditor_InheritEditorSettings,Inherit Editor Properties,继承编辑器设置,,Inherit button tool tip caption for editor settings
RoomEditor_InheritPhysicsSettings,Inherit Physics Properties,继承物理设定,,Inherit button tool tip caption for physics settings
RoomEditor_InheritRoomSettings,Inherit Room Settings,继承房间设置,,Inherit button tool tip caption for room settings
RoomEditor_InheritSubLayers,Inherit Sub Layers,继承子层,,Context menu option for inheriting sub layers from the parent layer
RoomEditor_InheritView,Inherit View,继承视野,,inherit toggle button caption for a single view entry
RoomEditor_InheritViewSettings,Inherit View Properties,继承视野设置,,Inherit button tool tip caption for view settings
RoomEditor_InheritVisibility,Inherit Layer Visibility,继承图层可见设置,,Context menu entry for whether a layer should inherit visibility state
RoomEditor_InstanceProperties,Instance: {0},实例:{0},,Instance properties window title
RoomEditor_KeepAllChildLayers,Keep All,保留全部,,layer delete confirm dialog message for the keep all button
RoomEditor_KeepBrokenChildLayers,Keep Changed,保留更改,,layer delete confirm dialog message for the keep changed button
RoomEditor_LayerProperties,{1} Layer Properties - {0},{1} 的属性 - {0},,Window title for the layer properties 
RoomEditor_Layers,Layers - {0},层 - {0},,Window heading for the room editor layers view
RoomEditor_NewAssetLayer,Create New Asset Layer,新建精灵层,,Tool tip for the new asset layer button
RoomEditor_NewBackgroundLayer,Create New Background Layer,新建背景层,,Tool tip for the new background layer button
RoomEditor_NewFolder,Create New Folder,新建文件夹,,Tool tip for the new folder button
RoomEditor_NewInstanceLayer,Create New Instance Layer,新建实例层,,Tool tip for the new instance layer button
RoomEditor_NewPathLayer,Create New Path Layer,新建路径层,,Create new path layer tool tip for room editor
RoomEditor_NewTileLayer,Create New Tile Layer,新建图块层,,Tool tip for the new tile layer button
RoomEditor_NoParentItemToolTip,"{0} ({1}, {2})","{0} ({1}, {2})",,instance/graphic tooltip when there is no parent item
RoomEditor_ItemToolTip,"{0} ({1}, {2}) parent - {3}","{0} ({1}, {2}) 父对象 - {3}",,instance/graphic tooltip when there is no parent item
RoomEditor_RoomProperties,Properties - {0},属性 - {0},,Window title for room properties
RoomEditor_InstanceCreationOrder,Instance Creation Order - {0},实例创建顺序 - {0},,Window title for instance creation order
RoomEditorMenu_InstanceCreationOrder,Instance Creation Order,实例创建顺序,,menu entry for instance creation order window
RoomEditor_SelectedTileBrush,Brush:,笔刷:,,Label for the currently selected tile editing brush
RoomEditor_SelectedTileTool,Tool:,工具:,,Label for the currently selected tile editing tool
RoomEditor_EditingWindowMode,Editing Mode:,编辑模式:,,Label for the TileSet macro page mode (selection or editing)
RoomEditor_TileWindow,Tiles - {0},图块 - {0},,Tile view/selection window title
RoomEditor_ZoomLevel,Zoom: {0}%,缩放: {0}%,,label to display the current zoom level
RoomEditorMenu_LayerProperties,Layer Properties,图层属性,,context menu option for opening the layer properties window
RoomEditorMenu_LayerView,Layer View,层视图,,menu entry to open the layer view
RoomEditorMenu_ResetWindowLayout,Reset Windows On Current Desktop,在当前桌面重置窗口,,menu entry to reset the room window layout bringing windows to the currently selected desktop
RoomEditorMenu_Room,Room,房间,,menu heading for the room editor
RoomEditorMenu_RoomProperties,Room Properties,房间属性,,menu entry to open the room properties
RoomEditorMenu_Windows,Windows,窗口,,sub menu entry for the room editor windows
RoomEditorTileEditing_ClearSelection,Clear Selection,清空选区,,Tile editing menu entry heading for clear the current mask selection
RoomEditorTileEditing_CopySelection,Copy Selection,复制选区,,Tile editing menu entry heading for copy the current mask selection
RoomEditorTileEditing_CutSelection,Cut Selection,剪切选区,,Tile editing menu entry heading for cut the current mask selection
RoomEditorTileEditing_DeleteSelection,Delete Selection,删除选区,,Tile editing menu entry heading for delete the current mask selection
RoomEditorTileEditing_InvertSelection,Invert Selection,反选,,Tile editing menu entry heading for invert the current mask selection
RoomEditorTileEditing_Menu,Tile Editing,图块编辑,,Tile editing sub menu entry heading
RoomEditorTileEditing_TileDisplayWindow,Tile Selection Window,图块选择窗口,,Tile editing menu entry heading for open the tile selection window
RoomEditorTool_AutoTile,Auto Tile (A),自动图块(A),,tooltip for auto tile tool
RoomEditorTool_SelectTiles,Select Tiles (S),选择图块(S),,tooltip for tile selection tool
RoomEditorTool_TileBrush,Paint Tiles,绘制图块,,Button tooltip for the tile brush tool
RoomEditorTool_TileEraser,Eraser (E),橡皮擦(E),,tooltip for tile eraser tool
RoomEditorTool_TileFlip,Flip (Y),翻转(Y),,tooltip for flip tile brush
RoomEditorTool_TileInheritance,Show Tile Inheritance,显示图块继承关系,,Tooltip message for the show tile inheritance button
RoomEditorTool_TileMirror,Mirror (X),镜像(X),,tooltip for mirror tile brush
RoomEditorTool_TilePaintInheritance,Edit Tile Inheritance (I),编辑图块继承关系(I),,tooltip for inheritance tile brush
RoomEditorTool_TilePen,Pen (D),笔(D),,tooltip for tile pen tool
RoomEditorTool_TileRotate,Rotate Tile (Z),旋转图块(Z),,tooltip for rotate tile brush
RoomEditorTool_TileFill,Fill (F),填充(F),,tooltip for fill tile tool
RoomEditorTool_TileLine,Line (L),线条(L),,tooltip for line tile tool
RoomEditorTool_TileRect,Rectangle (R),矩形(R),,tooltip for rectangle tile tool
RoomProperties_BackgroundColour,Room Colour,房间颜色,,room properties section heading for background colour
RoomProperties_ClearDisplayBuffer,Clear Display Buffer,清除显示缓存,,checkbox caption for clear display buffer option
RoomProperties_ClearView,Clear Viewport Background,清除视口背景,,checkbox caption for clear view background option
RoomProperties_Colour,Colour,颜色,,colour select box caption
RoomProperties_CreationCode,Creation Code,创建时代码,,button caption for opening creation code
RoomProperties_CreationOrder,Instance Creation Order,实例创建顺序,, button caption for opening the instance creation order window
RoomProperties_EnablePhysics,Enable Physics,启用物理,,Checkbox caption for enabling physics
RoomProperties_EnableViews,Enable Viewports,启用视野输出,,checkbox caption for enable views option
RoomProperties_GravityX,Gravity X,重力 X,,Numeric textbox caption for horizontal gravity
RoomProperties_GravityY,Gravity Y,重力 Y,,Numeric textbox caption for vertical gravity
RoomProperties_HBorder,Horizontal Border,水平边界,,numeric text box label for view for horizontal border
RoomProperties_Height,Height,高度,,numeric textbox caption for room height
RoomProperties_HSpeed,Horizontal Speed,水平速度,,numeric text box label for view for horizontal speed
RoomProperties_Persistent,Persistent,保持,,checkbox caption for persistent setting
RoomProperties_Physics,Room Physics,房间物理,,Room properties section heading for physics
RoomProperties_PixsToMeters,Pixels To Meters,像素-米比例尺,,Numeric textbox caption for pixels to meters conversion
RoomProperties_Settings,Room Settings,房间设置,,room properties section heading for settings
RoomProperties_ShowColour,Draw Background Colour,绘制背景颜色,,checkbox caption for drawing background colour
RoomProperties_Speed,Speed,速度,,numeric textbox caption for room speed
RoomProperties_VBorder,Vertical Border,垂直边界,,numeric text box label for view for vertical border
RoomProperties_View,Viewport {0},视口{0},,view instance heading in room properties
RoomProperties_ViewArea,Camera Properties,相机属性,,group heading for room view area settings
RoomProperties_ViewFollowing,Object Following,物体跟随,,group heading for object following settings
RoomProperties_ViewH,Height,高度,,numeric text box label for view or view port height
RoomProperties_Viewport,Viewport Properties,视口属性,,group heading for viewport settings
RoomProperties_Views,Viewports and Cameras,视口与相机,,room properties section heading for views
RoomProperties_ViewVisible,Visible,可见,,checkbox caption for whether the view is visible from room start
RoomProperties_ViewW,Width,宽度,,numeric text box label for view or view port width
RoomProperties_ViewX,X Pos,X 位置,,numeric text box label for view or view port x pos
RoomProperties_ViewY,Y Pos,Y 位置,,numeric text box label for view or view port y pos
RoomProperties_VSpeed,Vertical Speed,垂直速度,,numeric text box label for view for vertical speed
RoomProperties_Width,Width,宽度,,numeric textbox caption for room width
Run_Menu_Clean,Clean,清理,,"Run menu ""Clean"""
Run_Menu_CreateExecutable,Create Executable,创建可执行文件,,The Create Executable menu item
Run_Menu_RevealRemote,Show Remote Worker Installer,显示远程工作者安装程序,,Reveal worker menu item
Run_Menu_Run,Run,运行,,"Run menu ""Run"""
Run_Menu_RunDebug,Debug,调试,,"Run menu ""Debug"""
remote_worker_error,Error,错误,,Error Connecting to Remote Worker Dialog Title
remote_worker_error_connecting,Could not connect to Remote Worker.  Please check your setup and try again.,无法连接远程工作者.请检查你的安装,,Error Connecting to Remote Worker Dialog Contents
remote_worker_error_no_name,Remote Worker was left blank.  Please name your Remote Worker and try again.,远程工作者留空.请重命名远程工作者,,Error Connecting to Remote Worker Dialog Contents
Saving,Saving...,保存...,,Saving
SCM_Add_Path,Add Path,添加路径,,Add a path to the SCM
SCM_Clone,Clone Repository,克隆项目库,,Clone a Source Control Repository
SCM_Commit,Commit Changes,提交更改,,Commit local changes to Repository
SCM_Conflicts,Show Conflicts,显示冲突,,Show Conflicts within Repository
SCM_Create,Create Project Repository,创建项目库,,Create a local Source Control Repository for this project
SCM_Delete_Path,Delete Path,删除路径,,Delete a path from Source Control
SCM_History,View History,查看历史,,View Source Control Repository History
SCM_Import,Import Project into Repository,将项目导入库中,,Import a Game Maker Project to a Source Control Repository
SCM_Menu,Source Control,源码控制,,Source Control Menu title
SCM_Pull,Pull Changes,拉取变动,,Pull Changes from Source Control Repository
SCM_Push,Push Changes,推送变动,,Push Changes to Source Control Repository
SCM_Revert_All,Revert All,还原全部,,Revert all changes from Source Control
SCM_Revert_Path,Revert Path,还原路径,,Revert an item from Source Control
SCM_Revert_Revision,Revert To This Revision,还原到这次修订,,Revert to the selected revision in SCM
SCM_Conflict_Title,Source Control Conflicts,源码控制冲突,,Source Control Conflicts window title
SCM_Conflict_Theirs,Use Theirs,使用他们的,,"Use ""Their"" version to resolve conflict"
SCM_Conflict_Merge,Merge,合并,,Open Merge Tool
SCM_Conflict_MergeTool,Choose Merge Tool,选择合并工具,,Choose which merge tool to use
SCM_Conflict_MergeTool_Path,Tool location,工具的路径,,The Path to the Tool to use
SCM_Conflict_MergeTool_Options,Tool options,工具选项,,The Options to send to the Tool
SCM_Conflict_Mine,Use Mine,使用我的,,"Use ""Mine"" to resolve conflict"
SCM_Successful_Merge,Was the Merge operation successful?,合并操作是否成功？,,Wait for the Merge Tool to finish and ask the user if the operation has been a success
SearchReplace_Cancelled,Search Cancelled,搜索已被取消,,Search and Replace - Search Cancelled
SearchReplace_CaseSensitive,Case Sensitive,区分大小写,,Search and Replace - Case Sensitive
SearchReplace_Complete,Search Complete ({0} results),搜索完成 ({0} 结果),,Search and Replace - Search Complete
SearchReplace_ContentHeader,Content,内容,,"Search & Replace - Output window ""content"" header"
SearchReplace_EndOfResults,"End of search results reached, should we loop?",已到达搜索结果的末尾,,"End of Search and Replace results, loop to beginning or end?"
SearchReplace_FindAll,Find All,查找全部,,Search and Replace - Find All
SearchReplace_FindNext,Find Next,查找下一个,,Search and Replace - Find Next
SearchReplace_FindPrevious,Find Previous,查找上一个,,Search and Replace - Find Previous
SearchReplace_ItemHeader,Item,项,,"Search & Replace - Output window ""item"" header"
SearchReplace_LineHeader,Line,行,,"Search & Replace - Output window ""line"" header"
SearchReplace_NoResults,No results were found.,查无结果,,Search and Replace - No results found.
SearchReplace_Replace,Replace:,替换:,,Search and Replace - Replace
SearchReplace_ReplaceAll,Replace All,替换全部,,Search and Replace - Replace All
SearchReplace_ReplaceAllQuery,Are you sure you want to Replace All?\nThis will edit files on disk.,你确定要替换全部吗？\n这将编辑磁盘上的文件.,,Warn user that a Replace All will edit files on disk.
SearchReplace_ReplaceSelected,Replace,替换,,Search and Replace - Replace Selected
SearchReplace_Search,Search:,查找:,,Search and Replace - Search
SearchReplace_Title,Search & Replace,查找和替换,,Search and Replace title
SearchReplace_WholeWordOnly,Whole Word Only,全词匹配,,Search and Replace - Whole Word Only
SearchReplace_MoreResults,There are more results available...,还有更多结果...,,There are too many results to display
SoundEditor_Attributes,Attributes:,特征:,,Sound Editor Attributes - for choosing uncompressed/streaming options
SoundEditor_AudioGroup,Audio Group:,音频组:,,Sound Editor Audio Group labal
SoundEditor_BitRate,Bit Rate (kbps):,比特率(kbps):,,Sound Editor Target Bit Rate ( in kbps )
SoundEditor_Compressed_NotStreamed,Compressed - Not Streamed,压缩 - 非流式,,Sound Editor Attribute - Compressed and Not Streamed
SoundEditor_Compressed_Streamed,Compressed - Streamed,压缩 - 流式,,Sound Editor Attribute - Compressed - Streamed
SoundEditor_CopyingSound,Copying Sound...,复制声音...,,SoundEditor - copying sound to project
SoundEditor_EditSound,Edit Sound,编辑声音,,Sound Editor Edit Sound Button
SoundEditor_Name,Name:,名称:,,Sound Editor Name label
SoundEditor_NoSound,No Sound has been loaded,没有加载声音,,SoundEditor - no sound has been loaded
SoundEditor_Open,Open,打开,,Sound Editor - Open new sound
SoundEditor_Quality,Quality:,品质:,,Sound Editor Quality label
SoundEditor_SampleRate,Sample Rate:,采样率:,,Sound Editor Target Sample Rate
SoundEditor_SoundLoaded,Sound Loaded,声音已载入,,SoundEditor - Sound has been loaded
SoundEditor_TargetOptions,Target Options:,目标选项:,,"Sound Editor Target Options - for choosing sample rate, bit rate, etc..."
SoundEditor_Title,Sound: {0},声音:{0},,Title of SoundEditor window
SoundEditor_Uncompressed_NotStreamed,Uncompressed - Not Streamed,非压缩 - 非流式,,Sound Editor Attribute - Uncompressed and Not Streamed
SoundEditor_UncompressOnLoad_NotStreamed,Uncompress on Load - Not Streamed,载入时非压缩 -非流式,,Sound Editor Attribute - Uncompress on Load - Not Streamed
SoundEditor_Volume,Volume:,音量:,,Sound Editor Volume label
SoundEditor_Output,Output:,输出:,,Sound Editor Output label
SoundEditor_NoDeviceWarningTitle,No Audio Device,没有音频设置,,No audio device is available for previewing sounds warning dialog title
SoundEditor_NoDeviceWarning,No audio device is available for previewing sounds.,没有可以预览声音的音频设备,,No audio device is available for previewing sounds warning message
SoundEditor_StreamedAudioGroupWarning,Streaming sounds cannot be used in AudioGroups. Are you sure you want to set this to streaming? It will reset the AudioGroup back to Default.,声音流媒体不能在音频组中使用. 你确定要把它设置成流媒体吗? 它将把音频组重新设置成默认.,,warning message for streamed sound in audio group
SoundMixer_Title,Sound Mixer,混音器,,Title of SoundMixer window
SoundMixer_ColumnVolume,Column Volume,整列音量,,Column Volume Label
SoundMixer_UntitledGroup,Untitled Group,未命名组,,Label of Untitled Group
SoundMixer_TooManyGroupsTitle,Too Many Sound Mixer Groups,混音器组过多,,There are Too Many Sound Mixer Groups title
SoundMixer_TooManyGroups,There are too many Sound Mixer Groups on this window. You could open another Sound Mixer or close unused groups in this window.,窗口中混音器组过多.你可以在这个窗口内打开另外一个混音器或者关闭未使用的组。,,There are too many Sound Mixer Groups on this window. You could open another Sound Mixer or close unused groups in this window.t
SourceControl_ActionEnded,"Attempting to request further source control actions on '{0}' after end has been called, create a new sourcecontrolaction class or use WaitForPrevious to insert blocking sections between requests",尝试在'{0}'请求在结束后进一步的源代码控制动作被调用,,exception message for when the code has attempted to request an action after End() has been called
SourceControl_ActionIncomplete,Source Control Action '{0}' has not successfully completed,源码控制动作'{0}'尚未成功完成,,error message for a source control action End() returning from a blocking wait when the action hasn't fully completed
SourceControl_InvalidAction,Source Control Action '{0}' has an invalid action in the request queue,源码控制动作'{0}'在请求队列中有一个无效的动作,,exception message for when we have hit an invalid action request
SourceControlGit_NeedIdentity,Source Control (Git) Invalid Credentials,源码控制(Git)无效凭据,,Require Credentials Dialog Title
SourceControlGit_NeedIdentityMessage,The Repository '{0}' is expecting a different Username/Password than is set under the Identity preferences.,库 '{0}' 需要一个与身份设置偏好设置不同的用户名/密码.,,The Git repository is expecting a different username and password message.
SourceControlGit_NoRepoTitle,Source Control (Git) No Repository,源码管理(Git)中没有项目库,,There is no Git Repository (Title)
SourceControlGit_NoRepoMessage,"There is no Git repository configured with this Project.\nTry Create if you want a local repository, or Import into an existing one.",这个项目没有配置Git项目库.\n如果你想要要一个本地项目库,,"There is no Git Repository (Message) There is no repository at the project directory, perhaps try Create or Import."
SourceControlGit_NoIdentity,Source Control (Git) No Identity,源码控制(Git)没有标识,,There is no Git Identity set (Title)
SourceControlGit_NoIdentityMessage,There is no Git identity set under Preferences.\nPlease set one so that commits are correctly attributed!,首选项中没有设置Git标识.\n请设置一个以便提交能够正确的被归属！,,"There is no Git Identity set (Message) No identity credentials found in preferences, please set them."
SourceControlGit_Select_All,Select/Deselect All,选择/取消选择全部,,Select/Deselect all items to commit
SourceControlGit_Merging,Merge in Progress,正在合并,,Merge in Progress Status Message for Commit window
SourceControlGit_History_Files,Files Modified in Commit - {0},待提交的已修改文件 - {0},,Files Modified in Selected Commit
SourceControlGit_History_Message,Message for Commit - {0},提交的消息 - {0},,Message for Selected Commit
SourceControlGit_History_Commits,Commit History,提交历史,,Commit History
SourceControlGit_PageLeft,Previous Page,上一页,,Previous Page of Results
SourceControlGit_PageRight,Next Page,下一页,,Next Page of Results
SourceControlGit_SelectCommit,Select a Commit,选择一个提交,,Select a Commit message
SourceControlGit_AutoPopup,Automatically open source control output window,自动弹出源代码控制输出窗口,,Preference title for automatically popping up the source control output window
SourceControlGit_NoCommitMessage,"You have not specified a commit message, are you sure you want to continue?",你还没有指定一个提交信息,,No commit message specified warning
SourceControlConflictsDetected,"There are conflicts within this project. If the project is closed or reloaded, it may be broken until manually resolved. Are you sure you want to continue?",这个项目里出现了冲突.如果这个项目关闭了或重新加载,,Conflicts Detected message
sourcecontrolgit_auth_type,Authorisation Type,授权类型,,Type of Authorisation to use
sourcecontrolgit_auth_repository,Repository URL,项目库URL,,URL of Repository
sourcecontrolgit_auth_username,Username,用户名,,Username for authentication
sourcecontrolgit_auth_password,Password,密码,,Password for authentication
sourcecontrolgit_auth_public,Path to Public Key,公共密钥路径,,Path to Public Key for authentication
sourcecontrolgit_auth_private,Path to Private Key,私钥路径,,Path to Private Key for authentication
sourcecontrolgit_auth_userpass,Username/Password,用户名/密码,,Username and Password combination for authentication
sourcecontrolgit_auth_sshkeys,SSH Keys,SSH 密钥,,SSH Keypair combination for authentication
sourcecontrolgit_authentication_settings,Source Control (Git) Authentication Settings,源码控制 (Git) 身份认证设置,,Source Control (Git) Authentication Settings Window Title
sourcecontrolgit_difftool_path,Path to Diff tool,差异工具（Diff Tool）路径,,Path to Diff tool
sourcecontrolgit_difftool_options,Diff Tool Options,差异工具（Diff Tool）选项,,Options to pass to Diff tool
sourcecontrolgit_auth_add_userpass,Add User/Pass Authentication,添加新的用户/密码身份验证,,Add new User/Pass Authentication
sourcecontrolgit_auth_add_ssh,Add SSH Keypair Authentication,添加新的 SSH 密钥对身份验证,,Add new SSH Keypair Authentication
sourcecontrolgit_auth_failed,Source Control (Git) Authentication Failed,源码控制 (Git) 身份验证失败,,Authentication failed in Source Control (Git) error title
sourcecontrolgit_auth_userpass_failed,No Valid User/Pass Authentication details found for {0},找不到 {0} 的有效的用户名/密码身份验证详细信息,,No Valid User/Pass found for repository error message
sourcecontrolgit_auth_ssh_failed,No Valid SSH KeyPair Authentication details found for {0},找不到 {0} 的有效的SSH密码对身份验证详细信息,,No Valid SSH KeyPair found for repository error message
sourcecontrolgit_auth_create_keypair,Create KeyPair,创建密钥对,,Create SSH KeyPair button
sourcecontrolgit_auth_missingfield_title,Source Control (Git) Invalid Authentication,源码控制 (Git) 无效的身份验证,,Source Control (Git) Invalid Authentication title
sourcecontrolgit_auth_missing_repo,Repository field cannot be empty,库字段不能为空,,Warning that the repository field cannot be empty
sourcecontrolgit_auth_missing_username,Username field cannot be empty,用户名字段不能为空,,Warning that the username field cannot be empty
sourcecontrolgit_auth_missing_password,Password field cannot be empty,密码字段不能为空,,Warning that the password field cannot be empty
sourcecontrolgit_auth_missing_publickey,Cannot find Public key - please ensure path is valid,无法找到公共密钥 - 请确认路径是否有效,,Warning that the public key field is invalid
sourcecontrolgit_auth_missing_privatekey,Cannot find Private key - please ensure path is valid,不能找到私钥 - 请确保路径有效,,Warning that the private key field is invalid
sourcecontrolgit_auth_repo_exists,Authentication details for repository already exist,库的身份验证详细信息已经存在,,Authentication details for repository already exist
SourceControlGit_UnlocalisedError,{0},{0},,For when Git dies for some reason that we dont know why - display the exception directly
sourcecontrolgit_clone_repository,Source Control (Git) Clone Repository,源代码控制(Git)克隆项目库,,Clone Repository in source control git plugin
