Name,English,Translation,Restrictions,Comment
TextureAudioGroups_CyclicParent_Title,Invalid Parent,无效的父级,,Title for above warning
workspace_background_pref,Restore Default,恢复默认值,,Restore default background
IDETooltip_CurrentTarget,Current Build Target,当前构建目标,,tooltip for the current build target info
spriteanimmode,Default sprite animation mode,新的精灵的默认动画模式,,The default animation mode type for new sprites 
NewSpriteWidth,Default sprite width,新的精灵的默认宽度,,pref label
NewSpriteHeight,Default sprite height,新的精灵的默认高度,,pref label
TileSetEditorMenu_Delete,Delete,删除,,the delete animation or auto tile set context menu option
TileSetEditorMenu_Rename,Rename,重命名,,the rename animation or auto tile set context menu option
RoomEditor_NoSelectionPathLayerStatus,"LMB + T to translate path, LMB + R to rotate path, LMB + S to scale path",鼠标左键 + T 平移路径,,status bar information for editing paths
YYP_DragDrop_Message,Load the project instead of adding a datafile?,载入项目而不是添加一个数据文件？,,confirm message
YYP_DragDrop_Message_IDE,Load the project?,载入项目？,,confirm message
StartPage_Web_RefreshDemos,Refresh owned demos.,刷新拥有的演示工程.,,Refresh demos start page
YYP_DragDrop_Title,Project file detected,检测到项目文件,,dialog title
Archive_DragDrop_Message,Import the project instead of adding a datafile?,导入项目而不是添加一个数据文件？,,confirm message
Archive_DragDrop_Message_IDE,Import the project?,导入项目？,,confirm message
Archive_DragDrop_Title,Project archive detected,项目文档检测,,dialog title
GadgetToolbox_ExpandableCategory,Expandable Category,可扩展分类,,Dialog editor toolbox name
MarketplaceAsset_RemoveTooltip,Delete local content for this asset.,删除此资源的本地内容.,,Remove tooltip for marketplace assets
MarketplaceTutorial_DragDrop_Message,Open the tutorial instead of adding a datafile?,打开教程而不添加一个数据文件？,,confirm message
MarketplaceTutorial_DragDrop_Message_IDE,Open the tutorial?,打开教程吗？,,confirm message
MarkerplaceTutorial_DragDrop_Title,Tutorial package detected,教程包检测,,dialog title
MarketplacePackage_DragDrop_Message,Import marketplace package assets instead of adding a datafile?,导入市场扩展包而不是添加一个数据文件？,,confirm message
MarketplacePackage_DragDrop_Message_IDE,Import marketplace package?,导入市场扩展包吗？,,confirm message
MarketplacePackage_DragDrop_Title,Marketplace Package Detected,检测到市场扩展包,,dialog title
Dialog_CopyToClipboard,Copy to clipboard,复制到剪贴板,,Copy the dialog message to the clipboard
Marketplace_MyLibrary_Reviews,{0} reviews,{0} 条评论,,Review count label
Marketplace_MyLibrary_MadeWith,Created with {0},使用 {0} 创建,,Created with asset label
Marketplace_MyLibrary_SearchText,Search...,搜索...,,Search default text
Marketplace_MyLibrary_AllCategory,All Assets,所有资源,,Category all assets
Marketplace_MyLibrary_UpdateCategory,New Version ({0}),新版本 ({0}),,Category new version available
Marketplace_MyLibrary_ViewAuthor,Visit this author's page.,访问作者页面.,,Author link text
Marketplace_MyLibrary_ViewReviews,View this asset's reviews.,查看资源评论.,,Review link text
Marketplace_MyLibrary_Offline,Offline,离线,,Offline label
TileSetEditor_OpenClosedEdge_ToolTip,Open Or Closed Edges,打开或关闭边缘,,tooltip for the auto tile set option to have open or closed edges
Marketplace_MyLibrary_SearchCaption,Search Results ({0}),查找结果 ({0}),,Search caption
StartPage_Web_TooltipNotOwned,Acquire this tutorial,获取本教程,,Acquire tutorial tooltip
StartPage_Web_TooltipNotOwnedDemo,Acquire this demo,获取这个演示项目,,Acquire demo tooltip
StartPage_Web_OwnedTutorialsFiltered,Installed,已安装,,Installed filter text
PhysicsShapeWindow_CurFrame,Frame:,帧:,,Phsyics shape window toolbar frame label
Validation_ItemFrozen,"Item '{0}' is locked, unlock to allow editing",项目 '{0}' 被锁定,,validation error message when item is locked
Validation_ItemsFrozen,"Items '{0}' are locked, unlock to allow editing",项目 '{0}' 被锁定,,validation error message when multiple items are locked
Validation_LayerFrozen,"Layer '{0}' is locked, unlock to allow editing",层 '{0}' 被锁定,,validation error message when layer is locked
Validation_LayersFrozen,"Layers '{0}' are locked, unlock to allow editing",层 '{0}' 被锁定,,validation error message when multiple layers are locked
Validation_ItemOwnerLayerFrozen,"Owner layer '{0}' is locked, unlock to allow editing of item",所有者的层 '{0}' 被锁定,,validation error message when layer is locked
Validation_ItemOwnerLayersFrozen,"Owner layers '{0}' are locked, unlock to allow editing of items",所有者的层 '{0}' 被锁定,,validation error message when layer is locked
room_frozenitemchoice,Automatic response to item locked warning,解除项目锁定警告,,preference acceptance or show dialog message for editing locked items
room_frozenlayerchoice,Automatic response to layer locked warning,解除层锁定警告,,preference acceptance or show dialog message for editing locked layers
room_frozenownerlayerchoice,Automatic response to item owner layer locked warning,解除项所属层锁定警告,,preference acceptance or show dialog message for editing items within locked layers
TextureAudioGroups_NoneParent,None,无,,No parent
SettingsVertexLimit,Automatic response to exceeding physics vertex limit,超过物理顶点数量限制时的自动回应,,Settings box2d vertex limit
EventInherited_RequireModifierLookup,${ctrl}+MMB to open the inherited event instead of the manual.,${ctrl}+鼠标中键打开继承事件而不是帮助文档,,event_inherited lookup modifier on/off
VertexLimitWarning,A physics shape cannot have more than 8 points.,物理形体不能超过8个点.,,Vertex limit physics warning message
VertexLimitWarning_Title,Warning,警告,,Above message title
ObjectEditor_DropParentHere,Drop here to assign parent,拖到此处以分配父级,,Drop message for object parent
ObjectEditor_DropChildHere,Drop here to add child,拖到此处以添加子级,,Drop message for object child list
ObjectEditor_AddChildTooltip,Add child,添加子项,,Object editor child list add child tooltip
ObjectEditor_RemoveChildTooltip,Remove child,移除子项,,Object editor child list remove child tooltip
INVALID_FILEPATH_TITLE,Invalid Path,无效路径,,Invalid File path title
INVALID_FILEPATH_PATHTOOLONG,File path is too long: {0},文件路径太长: {0},,File at x has a path which is too long to handle
INVALID_INCLUDEDFILE_NAME_TITLE,Included File has invalid name,内含文件名称无效,,Invalid included file name dialog box title
INVALID_INCLUDEDFILE_NAME_MSG,"One or more included files has an invalid filename, should only contain a-z, A_Z, 0-9, _ or .\nSee the output panel for a list.",一个或多个项目内含文件包含无效的文件名,,Invalid included file name dialog box message
INVALID_INCLUDEDFILE_NAME,Included file with invalid filename: '{0}',无效文件名的项目内含文件: '{0}',,Invalid Included file name output message
Validate_InvalidFilename,'{0}' contains invalid filename characters,'{0}' 包含无效字符,,Rename message
roomeditor_selectioncolour,Selection frame colour,房间编辑器未锁定项的选择框颜色,,preference name for the selection frame colour for unlocked items in the room editor
roomeditor_selectionlockedcolour,Locked selection frame colour,房间编辑器锁定项的选框颜色,,preference name for the selection frame colour for locked items in the room editor
roomeditor_propertiescolour,Properties frame colour,房间编辑器未锁定项的属性框颜色,,preference name for the properties frame colour for unlocked items in the room editor
roomeditor_propertieslockedcolour,Locked properties frame colour,房间编辑器锁定项属性框颜色,,preference name for the properties frame colour for locked items in the room editor
roomeditor_selectionboundscolour,Selection bounds colour,房间编辑器所有未锁定项选框边界颜色,,preference name for the selection bounds colour for unlocked items in the room editor
roomeditor_selectionboundslockedcolour,Locked selection bounds colour,房间编辑器所有锁定项选框边界颜色,,preference name for the selection bounds colour for locked and unlocked items in the room editor
GridSettings_SnapToGridToolTip,Snap To Grid (${toggle_grid_snap}),对齐网格 (${toggle_grid_snap}),,the tooltip for the snap to grid checkbox
PhysicsShapeEditor_FrameOf,of,的,,Frame x of y label
ResourcePrefs_DefaultSpriteOrigin,Default sprite origin,新的精灵的默认原点,,Default sprite origin preference
ListBoxEnum_eLVEDisplayMode_TreeView,Tree View,树视图,,enum name
ListBoxEnum_eLVEDisplayMode_ListView,List View,列表视图,,enum name
ListBoxEnum_eLVEDisplayMode_Both,Both,两者,,enum name
ListBoxEnum_eOrigin_TopLeft,Top Left,左上,,enum name
ListBoxEnum_eOrigin_TopCentre,Top Centre,中上,,enum name
ListBoxEnum_eOrigin_TopRight,Top Right,右上,,enum name
ListBoxEnum_eOrigin_MiddleLeft,Middle Left,左中,,enum name
ListBoxEnum_eOrigin_MiddleCentre,Middle Centre,中心,,enum name
ListBoxEnum_eOrigin_MiddleRight,Middle Right,右中,,enum name
ListBoxEnum_eOrigin_BottomLeft,Bottom Left,左下,,enum name
ListBoxEnum_eOrigin_BottomCentre,Bottom Centre,中下,,enum name
ListBoxEnum_eOrigin_BottomRight,Bottom Right,右下,,enum name
RoomItem_RestoreNameUpdated,Attempting to restore item '{0}' name is already in use and has been updated to '{1}',试图还原的项目 '{0}' 的名称已经存在,,console log message when restoring an item whose name has been taken by another instance
Extraction_Error,ERROR: Unable to extract '{0}' at '{1}',错误:无法在'{1}'中提取 '{0}',,Error message when gmz/yyz extraction fails
FontEditor_SampleText,Sample Text,示例文本,,Font editor sample text
PhysicsShapeEditor_ToggleGrid,Toggle grid on or off.,开启或关闭网格.,,Toggle grid tooltip
PhysicsShapeEditor_PlayAnimation,Play or pause the sprite animation.,播放或暂停精灵动画.,,Play or pause tooltip
PhysicsShapeEditor_CurrentFrameTooltip,Set the displayed sprite frame,设置显示的精灵帧,,Current frame tooltip
PhysicsShapeEditor_SnapX,Set the horizontal grid alignment.,设置水平网格对齐.,,Snap x tooltip
PhysicsShapeEditor_SnapY,Set the vertical grid alignment.,设置垂直网格对齐.,,Snap y tooltip
GeneralSettings_ChainSoftness,Workspace chain rendering segment count,连接线需要渲染成多少段？,,Chain softness preference
DnDModule_ToggleBreakpoint,Toggle Breakpoint,开/关断点,,Toggle breakpoint on a DnD™ node
DnDModule_DisableNode,Disable,禁用,,Disable node output
DnDModule_EnableNode,Enable,启用,,Enable node output
DnDModule_ToggleDisabled,Toggle Enabled,切换启用,,Toggle node output
DnDModule_NodeDisabled,(Disabled),(禁用),,Node disabled story entry
DnDModule_DeleteAllBreakpoints,Delete All Breakpoints,删除所有的断点,,Delete breakpoints on selected DnD™ nodes
DnDModule_DeleteNode,Delete,删除,,DnD™ module delete selected
IDETooltip_LaptopMode_Title,Laptop Mode ({0}),笔记本模式 ({0}),,IDE toolbar laptop mode title
IDETooltip_LaptopMode_On,On,开,,On text
IDETooltip_LaptopMode_Off,Off,关,,Off text
IDETooltip_LaptopMode_Description,"In Laptop Mode you can pan, scroll and zoom by moving the mouse over an area\nwhile holding Left Control to zoom and Left Alt to pan and scroll.\nUse Right Control and Right Alt for non-mouse interactions while Laptop Mode is enabled.",笔记本模式下你可以通过在一个范围内移动鼠标进行平移,,IDE toolbar laptop mode description
MyAccount_Offline,Cannot access account management: User is offline,无法访问帐号管理:用户离线,,User is offline and trying to access My Account
UserOffline_NeedsInternet,Please make sure you have a working internet connection and try again.,请确保你有一个在工作的互联网连接,,User is offline
MyAccount_WorkspaceTitle,My Account,我的帐户,,My account workspace title
RoomEditor_IgnoreItem,Export,导出,,checkbox for whether the item will be exported to the runner
StartPage_ProjectNotExistsTitle,Project Missing,项目丢失,,Project does not exist title
StartPage_ProjectNotExists,This project may have been moved or deleted.\nPlease verify the project location and try again.,这个项目可能已被移动或删除.\n请确认项目的位置,,Project does not exist
TileSet_Libraries,Libraries,库,,the tile selection window libraries tab title
TileSet_Brushes,Brushes,笔刷,,the tile selection window brushes tab title
Validate_MaintainFileExtension,"Invalid name, cannot change extension from '{0}' to '{1}'.",无效的名称,,extension placeholder message
ObjectEditor_EditParent,Edit Parent,编辑父项,,Edit parent object tooltip
ObjectEditor_EditMask,Edit Mask,编辑遮罩,,Edit mask tooltip
StartPage_Web_RefreshTutorials,Refresh owned tutorials.,刷新拥有的教程.,,Refresh tutorials tooltip
Tooltip_ResizeSprite,Resize Sprite,调整精灵大小,,Sprite resize button tooltip
Debugger_ErrorMsg,An error has occurred in the game. See error message below.,游戏出错了，请看下方的错误消息。,,Debugger game error label
Debugger_TabTitle,Debugger,调试器,,Debugger tab title
Debugger_Window_ResourceView,Resource View,资源视图,,Debugger resource view window title
Debugger_Window_SourceView,Source View,源代码视图,,Debugger source view window title
Debugger_Window_LocalsView,Locals,局部变量,,Debugger locals window title
Debugger_Window_GlobalsView,Globals,全局变量,,Debugger globals window title
Debugger_Window_WatchView,Watch,监视变量,,Debugger watch window title
Debugger_Window_InstanceView,Instance,实例,,Debugger instance window title
Debugger_Window_AllInstancesView,All Instances,所有实例,,Debugger all instances window title
Debugger_Window_SelectedInstanceView,Selected Instance,所选实例,,Debugger selected instance window title
Debugger_Window_SelectedInstanceView_Arg,Selected Instance {0},所选实例{0},,Debugger selected instance window title with argument
Debugger_Window_Callstack,Call Stack,调用栈,,Debugger call stack window title
Debugger_Window_Surfaces,Surfaces & Textures,表面与纹理,,Debugger surfaces window title
Debugger_Window_Graph,Graph,图线,,Debugger graph window title
Debugger_Window_Profile,Profile,分析,,Debugger profile window title
Debugger_Window_Buffers,Buffers,缓冲区,,Debugger buffers window title
Debugger_Window_RenderState,Render States,渲染状态,,Debugger render states window title
Debugger_TimelineMoment,Moment {0},时刻 {0},,Debugger timeline moment label
Debugger_Toltip_Run,Continue (${debugger_continue}),继续 (${debugger_continue}),,Debugger tooltip
Debugger_Toltip_Break,Break,中断,,Debugger tooltip
Debugger_Toltip_Restart,Restart game,重启游戏,,Debugger tooltip
Debugger_Toltip_Stop,Close the game,关闭游戏,,Debugger tooltip
Debugger_Tooltip_Close,Discard the collected data and end the debugging session.,丢弃已收集的数据并结束调试进程。,,Toltip lol
Debugger_Toltip_StepInto,Step into function call (${debugger_step_into}),跳入函数调用 (${debugger_step_into}),,Debugger tooltip
Debugger_Toltip_StepOver,Step over function call (${debugger_step_over}),跳过函数调用 (${debugger_step_over}),,Debugger tooltip
Debugger_Toltip_StepOut,Step out of function (${debugger_step_out}),跳出函数 (${debugger_step_out}),,Debugger tooltip
Debugger_Toltip_Realtime,Enable real-time debugging,启用实时调试,,Debugger tooltip
Debugger_SourceModified,Source Modified,源码已修改,,Debugger source modified window title
Debugger_SourceModified_Msg,The source code in {0} has been modified and cannot be debugged.,位于{0}的代码已经被改动，无法调试。,,Debugger source modified window message
Debugger_MenuBar_Debugger,Debugger,调试器,,Debugger menu bar
Debugger_RoomNoCode,This room has no creation code,该房间无创建时代码,,Debugger no code label
Debugger_ObjectNoCode,This object has no source code,该物体没有源代码,,Debugger no code label
Debugger_ScriptNoCode,This script has no source code,该脚本没有源代码,,Debugger no code label
Debugger_TimeLineNoCode,This time line has no moments with source code,该时间轴无带有源代码的时刻,,Debugger no code label
Debugger_ExtensionNoCode,This extension has no exported functions,该扩展中无导出的函数,,Debugger no code label
Debugger_CallStack_Name,Name,名称,,Debugger call stack name column
Debugger_Surfaces_Type,Type,类型,,Debugger surfaces type column
Debugger_Surfaces_Texture,Thumbnail,缩略图,,Debugger surfaces texture column
Debugger_Surfaces_Size,Size,大小,,Debugger surfaces size column
Debugger_SurfaceView_NoneSelected,Double-click a resource in the Resource View to view its source code here,在资源视图下双击一个资源来在此处查看源代码,,Debugger no source code selected
Debugger_CallStack_Empty,The call stack is empty.,调用栈为空,,The call stack is empty label
Debugger_StackFrame_Tooltip,Double-click to go to this stack frame,双击前往该栈帧,,Debugger stack frame tooltip
Debugger_MemoryUsage,Memory: ,内存：,,Debugger memory usage label
Debugger_Fps,FPS: ,帧速率(FPS)： ,,Debugger fps label
Debugger_DataGrid_Name,Name,名称,,Debugger data grid name column
Debugger_DataGrid_Value,Value,值,,Debugger data grid value column
Debugger_Dock_Variables,Variables,变量,,Debugger variables dock
Debugger_Dock_Graphics,Graphics,图像,,Debugger graphics dock
Debugger_Dock_Instance,Instances,实例,,Debugger instance dock
Debugger_Dock_Misc,Others,其他,,Debugger miscellaneous dock
Debugger_Dock_Debugger,Debugger,调试器,,Debugger dock
Debugger_Buffer_textOnly,Show Text Only,仅显示文本,,Buffer view type
Debugger_Buffer_numbersOnly,Show Numbers Only,仅显示数字,,Buffer view type
Debugger_Buffer_byte1,1-byte Integer,单字节整数,,Buffer view type
Debugger_Buffer_byte2,2-byte Integer,双字节整数,,Buffer view type
Debugger_Buffer_byte4,4-byte Integer,四字节整数,,Buffer view type
Debugger_Buffer_float32,32-bit Floating Point,32位浮点数,,Buffer view type
Debugger_Buffer_float64,64-bit Floating Point,64位浮点数,,Buffer view type
Debugger_Buffer_hex,Hex,十六进制,,Buffer view type
Debugger_Buffer_signed,Signed,有符号,,Buffer view type
Debugger_Buffer_unsigned,Unsigned,无符号,,Buffer view type
Debugger_Buffer_Id,Buffer ID,缓冲区ID,,Buffer id label
Debugger_Buffer_Columns,Columns,列,,Buffer columns label
Debugger_Buffer_Type,Type: {0},类型： {0},,Buffer type label
Debugger_Buffer_Size,Size: {0},大小：{0},,Buffer size label
Debugger_Buffer_Tell,Tell: {0},Tell: {0},,Buffer tell label
Debugger_Buffer_Alignment,Alignment: {0},对齐：{0},,Buffer alignment label
Debugger_Buffer_ColumnsAuto,Auto,自动,,Debugger auto columns label
Debugger_Buffer_NoneSelected,There is no buffer associated with identifier {0},没有关联于标识符{0}的缓冲区,,Debugger buffer none selected label
Debugger_ViewType_Real,Real,实数,,debugger view type real
Debugger_ViewType_DSList,ds_list,列表结构,,debugger view type ds_list
Debugger_ViewType_DSMap,ds_map,映射结构,,debugger view type ds_map
Debugger_ViewType_DSStack,ds_stack,堆栈结构,,debugger view type ds_stack
Debugger_ViewType_DSQueue,ds_queue,队列结构,,debugger view type ds_queue
Debugger_ViewType_DSPriority,ds_priority,优先队列结构,,debugger view type ds_priority
Debugger_ViewType_DSGrid,ds_grid,栅格结构,,debugger view type ds_grid
Debugger_ViewType_Instance,Instance,实例,,debugger view type Instance
Debugger_Surface,Surface {0},表面 {0},,Debugger surface label
Debugger_Texture,Texture {0},纹理 {0},,Debugger texture label
Debugger_Surface_View,Surface,表面,,Debugger surface label
Debugger_Texture_View,Texture,纹理,,Debugger texture label
Debugger_Menu_Windows,Windows,窗口,,Debugger menu item
Debugger_ResetLayout,Reset Window Layout,重置窗口布局,,Debugger reset window layout menu item
Debugger_Graph_Mem,Mem {0},内存使用量 {0},,Debugger graph memory
Debugger_Graph_Fps,Fps {0},帧速率(Fps) {0},,Debugger graph fps
Debugger_Graph_GameFps,Game Fps {0},游戏帧速率 {0},,Debugger graph game fps
Debugger_Graph_Avg,Avg {0},均值{0},,Debugger graph average label
Debugger_Graph_FpsAvg,Fps Avg {0},平均帧速率 {0},,Debugger graph average label
Debugger_Graph_MemAvg,Mem Avg {0},内存平均使用量 {0},,Debugger graph average label
Debugger_ViewAs,View As...,视为……,,watch contect menu view as
Debugger_DeleteWatch,Delete Watch,删除监视变量,,watch contect menu delete watch
Debugger_ClearWatches,Clear All,清空全部,,watch contect menu delete all watches
Debugger_AddWatch,Add Watch,添加监视变量,,debugger context menu add watch
Debugger_Profiler_Start,Start Profiling,开始分析,,debugger start profiling
Debugger_Profiler_Stop,Stop Profiling,停止分析,,debugger start profiling
Debugger_Profiler_Running,Profiling...,分析中……,,debugger profiling
Debugger_Profiler_Averages,Average Values,平均值,,Debugger show average values
Debugger_Profiler_Averages_Tooltip,Tick this to display all values as averages.\nUntick it to display accumulated values.,勾选该项将显示所有值的平均值\n解除该项显示累计值。,,Debugger averages tooltip
Debugger_DataGrid_CallCount,Call Count,调用次数,,Debugger call count
Debugger_DataGrid_Time,Time (Ms),时间（毫秒）,,Debugger time count
Debugger_DataGrid_Step,Step %,Step %,,Debugger step % column
Debugger_Graph_Help,This graph shows frames per second and memory usage over time.\nHold Control and scroll to expand and contract the graph.,该图线显示帧秒速率（FPS）及随时间的内存使用量。\n按住Ctrl并滚动滑轮可以伸展或收缩图线。,,Debugger graph help icon
Debugger_Graph_Help_Mac,This graph shows frames per second and memory usage over time.\nHold ⌘ and scroll to expand and contract the graph.,该图线显示帧秒速率（FPS）及随时间的内存使用量。\n按住?并滚动滑轮可以伸展或收缩图线。,,Debugger graph help icon
Debugger_FailedToEvaluate,Failed to evaluate expression,表达式求值失败,,Debugger failed to evaluate expression
Debugger_Connection_Active,Active connection to game,与游戏的活动连接,,Debugger active connection
Debugger_Connection_Pending,Connecting to game...,正在连接到游戏……,,Debugger pending connection
Debugger_Connection_Closed,No connection to game,没有与游戏连接,,Debugger no connection
Debugger_GraphView_ShowWindow,Click to open in a window.,点击打开窗口,,Debugger open in window label
Debugger_GraphView_Tags_WindowTitle,Debug Events - Tick {0},调试事件 - Tick {0},,Debug events window title
Debugger_IPDialog_Title,Device IP Required,请提供设备IP,,Debugger IP Address dialog title
Debugger_IPDialog_Message,Target Device IP is required to connect the debugger,需要提供连接到调试器的目标设备IP,,Debugger IP Address dialog message
Debugger_IPDialog_Button,Open Device Settings,打开设备设置,,Debugger IP Address button caption
Debugger_AttachToProgramDialog_Title,Enter Debugger Connection String,输入调试连接字符串,,Debugger Connection dialog title
Debugger_AttachToProgramDialog_Message,Debugger Connection String,调试连接字符串,,Debugger Connection String
Debugger_AttachToProgramDialog_Button,Connect,连接,,Debugger Attach to Program button caption
Debugger_AttachToProgram_YYDebugFile,.yydebug File,.yydebug文件,,yydebug file caption
Debugger_AttachToProgram_YYDebugFile_Tooltip,The location of the yydebug file for the program to connect to,程序要连接的yydebug文件位置,,yydebug file location tooltop
Debugger_AttachToProgram_YYDebugFile_Extension,yydebug,yydebug,,yydebug file extension
Debugger_AttachToProgram_Host,Name/IP,名称/IP,,hostname or IP of machine the program is running on
Debugger_AttachToProgram_Host_Tooltip,The host name or IP address the program is running on,运行程序的主机名或IP地址,,Tool tip for Name/IP
Debugger_AttachToProgram_Port,Port,端口,,Port the debugger is listening on
Debugger_AttachToProgram_Port_Tooltip,The port the debugger should connect to,调试器应该连接的端口,,Port the debugger should connect on tooltip
Debugger_AttachToProgram_Error_Title,Error,错误,,Title for the error dialog shown when the attach to program dialog is filled out incorrectly
Debugger_AttachToProgram_Error_YYDebugFile,Cannot find yydebug file specified.  Cancelling debugger connection.,找不到指定yydebug文件，终止调试连接,,Error shown when the yydebug file is not correct
Debugger_AttachToProgram_Error_Host,Name/IP is invalid.  Cancelling debugger connection.,名称/IP无效，终止调试连接,,Error shown when the IP/Name is not correct
Debugger_AttachToProgram_Error_Port,Port is invalid.  Cancelling debugger connection.,端口无效。终止调试连接,,Error shown when the port number is invalid
Debugger_Watches_AddNewWatch,Add new watch...,添加新的监视内容,,Watches add new text
Debugger_OnlyAvailableWindows,Only available with Windows target,只在Windows目标上可用,,selected instance windows only message
Debugger_CloseMessage_NoGame,This will close the debugger and permanently discard all collected data.,这会关闭调试器并永久丢弃所有已收集的数据This will close the debugger and permanently discard all collected data.,,Close debugger without a running game
