Name,English,Translation,Restrictions,Comment
SaveProjectAs_DeleteExisting,Are you sure you want to delete all files in '{0}'?,你确定要删除 '{0}' 里的所有文件吗？,,Confirmation for deleting an existing project and related files
SplashScreen_PluginLoadFailed,Failed to load a required plug-in.  Please try restarting GameMaker Studio 2.  If the problem persists please reinstall GameMaker Studio 2.,加载所需插件失败.请尝度重启 GameMaker Studio 2. 如果问题仍然存在,,Error message when you fail to load a required plugin dll
SplashScreen_PluginLoadFailedTitle,Failed to load a required plug-in,加载所需插件失败.,,Title for error message when you fail to load a required plugin dll
SplashScreen_LaunchProjectNotFound,Project '{0}' does not exist,项目 '{0}' 不存在,,Message dialog when the program was launched with a file command argument but the file was not found
SplashScreen_LaunchProjectInvalid,'{0}' is not a valid GameMaker Studio 2 project,'{0}' 不是有效的 GameMaker Studio 2 项目,,Message dialog when the program was launched with a file command argument of a non .yyp file
SplashScreen_LaunchProjectFailed,Launch Project Failed,启动项目失败,,Message dialog title when the program was launched with a file command argument but it has failed
LicensedModulesError,Your licence does not have this module enabled,你的许可证中没有这个模块.,,Message Dialog for when a user tries to build/run a target their licence doesn't have
DnD_Pref_ToolboxLocation,DnD™ toolbox default location,默认的工具栏位置是？,,DnD™ pref
DnD_Pref_StoryMode,DnD™ node overview visibility mode,这个概述什么时候出现在节点旁边？,,DnD™ pref
DnD_Pref_CollapseToolbox,Hide docked DnD™ toolboxes if floating DnD™ toolbox is open,如果有一个浮动工具栏,,DnD™ pref
DnD_Pref_CollapseStory,Hide DnD™ node overview panel,是否默认将该概述面板折叠?？,,DnD™ pref
DnD_Pref_MaxThumbSize,Maximum size for DnD™ toolbox action thumbnails,工具栏动作缩略图的最大尺寸,,DnD™ pref
DnD_Pref_MinThumbSize,Minimum size for DnD™ toolbox action thumbnails,工具栏动作缩略图的最小尺寸,,DnD™ pref
DnD_Pref_ThumbSize,Default size for DnD™ toolbox action thumbnails,工具栏动作缩略图的默认尺寸,,DnD™ pref
DnD_Pref_RecentlyUsed,Maximum number of recently used actions to display,最近使用动作的最大显示数目,,DnD™ pref
DnD_Pref_ChainSmoothness,The smoothness of the chain.,连线的平滑度,,DnD™ pref
DnD_Pref_DragTime,Mouse down time to start dragging node (ms),按住鼠标到拖动节点所需的时间(毫秒).,,DnD™ pref
DnD_Message_Error_Prefix,ERROR:,错误:,,DnD™ message prefix
DnD_Message_InvalidSyntaxError,The {0} node is causing an invalid program flow. Move it to a correct location.,"节点 ""{0}"" 正导致无效的程序流.请将它移动到正确的位置.",,DnD™ message syntax error
DnD_Message_InvalidSyntaxInsertionTitle,Invalid Insertion,无效插入,,DnD™ pop up title for below message
DnD_Message_InvalidSyntaxInsertion,Inserting {0} at this location would result in an invalid program.,在这个位置插入 {0} 将会导致程序无效.,,DnD™ pop up message for invalid syntax insertion
ggs_webserver_port,Webserver Port,Web服务器端口,,Webserver Port
ggs_webserver_ips,Allowed Webserver IPs,允许的 Web服务器 IP,,Allowed IPs to connect to the debug webserver
ggs_browser_path,Path to Browser,浏览器地址,,Path to Browser to use for testing HTML5
Views_Menu_SyntaxErrors,Syntax Errors,语法错误,,Open Syntax Errors Window
SyntaxErrors,Syntax Errors,语法错误,,Syntax Errors
SyntaxErrors_NoErrors,There are no syntax errors detected!,没有监测到语法错误！,,No Syntax Errors found message
Project_DirectoryLost_Message,Project directory '{0}' is no longer available you will be unable to save progress until the directory is reconnected,项目目录'{0}'不再可用，在该目录重连之前您都无法保存进度,,message box contents when the project directory has been unavailable for a few minutes
Project_DirectoryLost_Title,Project Directory Unavailable,项目目录不可用,,message box title when the project directory has been unavailable for a few minutes
Project_InheritedDirectoryLost_Message,Base project directory '{0}' is no longer available you will not receive notifications for changes,基础项目目录 '{0}' 不可用,,message box contents when the project directory has been unavailable for a few minutes
Project_InheritedDirectoryLost_Title,Base Project Directory Unavailable,基础项目目录不可用,,message box title when the inherited project directory has been unavailable for a few minutes
Project_DirectoryReconnected_Message,"Project directory '{0}' has been reconnected. There may have been undetected changes, would you like to reload the project or save? \n\nWARNING: Save will only update the resources files that are currently held in memory, and therefore may not restore some deleted or edited files",项目目录 '{0}' 已经连接.可能还有未被发现的更改,,message box contents when the project directory has been reconnected
Project_DirectoryReconnected_Title,Project Directory Reconnected,项目目录重新连接,,message box title when the project directory has been reconnected
Project_InheritedDirectoryReconnected_Message,"Base project directory '{0}' has been reconnected. There may have been undetected changes, would you like to reload the project?",基础项目目录 '{0}' 已经连接.可能有未被发现的更改,,message box contents when the project directory has been reconnected
Project_InheritedDirectoryReconnected_Title,Base Project Directory Reconnected,基础项目重新连接,,message box title when the inherited project directory has been reconnected
Project_LargeChanges_Message,"Project directory '{0}' has had a large number of changes detected. Would you like to reload the project, or save?\n\nWARNING: Save will only update the resources files that are currently held in memory, and therefore may not restore some deleted or edited files",项目目录 '{0}' 监测到大量更新.你想要重新加载项目,,message box contents when the project directory has been reconnected due to a buffer overflow
Project_LargeChanges_Title,Project Directory Modified,项目目录被修改,,message box title when the project directory has been reconnected due to a buffer overflow
Project_InheritedLargeChanges_Message,"Base project directory '{0}' has been reconnected. There may have been undetected changes, would you like to reload the project?",基础项目目录 '{0}' 已经连接.可能有未被发现的更改,,message box contents when the project directory has been reconnected due to a buffer overflow
Project_InheritedLargeChanges_Title,Base Project Directory Modified,项目根目录被修改,,message box title when the inherited project directory has been reconnected due to a buffer overflow
ProjectReconnected_Reload,Reload,重新载入,,button message for reloading the project
ProjectReconnected_Save,Save,保存,,button message for saving the project
Project_Changes_Message,"Changes detected in project directory '{0}'. Would you like to reload the resources, or save?\n\nWARNING: Save will only update the resources files that are currently held in memory, and therefore may not restore some deleted or edited files",项目目录'{0}'中监测到更改.你想要重新加载项目,,message box contents when the project directory has detected changes
Project_Changes_Title,Project Directory Modified,项目目录被修改,,message box title when the project directory has detected changes
Project_InheritedChanges_Message,"Changes detected in base project directory '{0}'. Would you like to reload the resources, or save?\n\nWARNING: Save will only update the resources files that are currently held in memory, and therefore may not restore some deleted or edited files",基础项目目录'{0}'中监测到更改.你想要重新加载项目,,message box contents when the project directory has detected changes
Project_InheritedChanges_Title,Project Directory Modified,项目目录被修改,,message box title when the project directory has detected changes
Project_ProjFileChanged_Message,"The main project file '{0}' has changed. Would you like to reload the resources, or save?\n\nWARNING: Save will only update the resources files that are currently held in memory, and therefore may not restore some deleted or edited files",主项目文件 '{0}' 已被修改.你想要重新加载项目,,message box contents when the main project file has changed
Project_ProjFileChanged_Title,Project Modified,项目修改?,,message box title when the main project file has changed
Project_Deleted_Title,Project Deleted,项目删除,,message box title when a project has been deleted
Project_Deleted_Message,The project file '{0}' was deleted. Your project will now be closed.,项目 '{0}' 已经删除.你的项目现在将被关闭.,,Error message telling the user the project has been deleted
keystore_filename,Filename,文件名,,Keystore Filename
keystore_password,Password,密码,,Keystore Password
keystore_alias,Alias,别名,,Keystore Alais
keystore_commonname,Common Name,通用名,,Keystore Common Name
keystore_organisationalunit,Organisational Unit,组织单位,,Keystore Organisational Unit
keystore_organisation,Organisation,组织,,Keystore Organisation
keystore_location,Location,位置,,Keystore Location
keystore_country,Country,国家,,Keystore Country
keystore_keyhash,Key Hash,密钥哈希,,Keystore Key Hash
keystore_keyhash_sha1,Key Hash (SHA1),密钥哈希 (SHA1),,Keystore SHA1 Key Hash
keystore_show_keyhash,Show Key Hash,显示密钥哈希,,Show Keystore Key Hash
keystore_generate_keyhash,Generate Keystore,生成密钥库,,Generate Keystore Key Hash
android_checksdk,Check Android SDK,检测Android SDK,,Check Android SDK setup correctly
android_checkndk,Check Android NDK,检测Android NDK,,Check Android NDK setup correctly
android_issdkvalid,Is Android SDK Valid,Android SDK 是否有效,,Is Android SDK valid
android_sdkvalid,Android SDK Valid,AndroidSDK 有效,,Android SDK is valid
android_sdknotvalid,Android SDK Not Valid,Android SDK 无效,,Android SDK is not valid
android_sdknotvalid_nokeystore,Android SDK Not Valid - Missing Keystore,Android SDK 无效 - 丢失密钥,,Android SDK Not Valid - Missing Keystore
android_sdknotvalid_invalidjdk,Android SDK Not Valid - Invalid JDK,Android SDK 无效 - JDK 无效,,Android SDK Not Valid - Invalid JDK
android_sdknotvalidated,Android SDK Not Validated,Android SDK 尚未被校验,,Android SDK is not validated
android_isndkvalid,Is Android NDK Valid,Android NDK 是否有效,,Is Android NDK valid
android_ndkvalid,Android NDK Valid,Android NDK 有效,,Android NDK is valid
android_ndknotvalid,Android NDK Not Valid,Android NDK 无效,,Android NDK is not valid
android_ndknotvalidated,Android NDK Not Validated,Android NDK 尚未被校验,,Android NDK is not validated
android_sdklocation,Android SDK Location,Android SDK 位置,,Location of Android SDK
android_ndklocation,Android NDK Location,Android NDK 位置,,Location of Android NDK
android_jdklocation,Java JDK Location,Java JDK 位置,,Location of Java JDK
android_fullinstall,Always do full install of APK,总是安全安装 APK,,Always do full install of APK
android_packageinstall,Install on package,安装APK程序包,,Install on Package
android_maxheapsize,JDK maximum heap size (GB),JDK 最大堆大小 (1GB以内?),,Android build system max heap size
android_maxheapsize_tooltip,Gigabytes of RAM the Android build is allowed to use,在Android平台构建时允许使用GB数量级的内存,,Android build system max heap size tooltip
android_usemac,Use Mac for ADB connection,使用 Mac 作为 ADB 连接,,Use Mac for ADB connection
android_macadbpath,ADB Path on Mac,Mac 上的 ADB 路径,,ADB Path on Mac
android_ipaddress,IP Address,IP 地址,,IP Address
android_keystore,Android Keystore,Android 密钥,,Android Keystore
android_keystorepath,Path to Keystore,密钥库的路径,,Path to Keystore
android_keystore_warning1,IMPORTANT! Backup keystore files and info above!,重要！备份上面的密钥文件和信息！,,IMPORTANT! Backup keystore files and info above!
android_keystore_warning2,"If lost, you cannot submit app updates to Google Play or Amazon",如果失败，您将无法向Google Play或Amazon Fire提交应用更新,,If lost you cannot submit app updates to Google Play or Amazon
android_package_name_invalid_title,Package name is invalid,包名不合法,,Android package name is invalid
android_package_name_invalid,Individual package name parts may only start with a letter and cannot be a reserved Java keyword,独立包名部分只能以字母打头,,Android package name is invalid message and why
clearoutputwindowoncompile,Clear output window on compile start,编译开始时清空输出窗口,,Option to clear the output window on each compile
openpackagesinexplorer,Show package in ${explorer} on build completion,创建包后在资源管理器窗口中高亮显示.,,Setting in Preferences General Compiling
Build_StopBeforeRun,Stop the current running project before running again?,再次运行前是否停止当前运行的项目？,,Stop the current running project before running again?
Build_NoDebugInYYC,"You cannot debug a project while using YYC, running using VM instead.",使用 YYC而非虚拟机（VM）运行时不能调试项目,,Dialog shown when trying to debug a build whilst YYC is selected
Configuration_Problem,Configuration Problem,配置问题,,There is a configuration problem with preferences or platform options
Build_AndroidSDK_NotFound,The path to the Android SDK cannot be found. Please ensure it is set correctly,路径下无法找到Android SDK.请确认它被正确的设置.,,The path to the Android SDK is wrong
Build_AndroidNDK_NotFound,The path to the Android NDK cannot be found. Please ensure it is set correctly,该路径下无法找到Android NDK.请确认它被正确的设置.,,The path to the Android NDK is wrong
Build_AndroidJDK_NotFound,The path to the Java JDK cannot be found. Please ensure it is set correctly,路径下无法找到Java JDK.请确认它被正确的设置.,,The path to the Java JDK is wrong
Build_Android_NoArchs,No Architectures have been specified in the Android Options,在Android选项中没有指定架构,,No Architectures were selected in the Android options
Build_Android_NoKeystore,No Keystore has been set in the Android Preferences,在Android首选项中没有设置密钥库,,No Keystore has been set in the Android Preferences
Build_AmazonFire_NoKeystore,No Keystore has been set in the Amazon Fire Preferences,"Changes detected in base project directory '{0}'. Would you like to reload the resources, or save?\n\nWARNING: Save will only update the resources files that are currently held in memory, and therefore may not restore some deleted or edited files",,No Keystore has been set in the Amazon Fire Preferences
Layer_Depth,Depth,深度,,the layer depth property caption
stopbeforerun,Automatic response to restarting a running build,重新运行生成项时的默认处理,,Automatic choice for stopping a current running build before running again.
maxparalleljobscompiling,Maximum parallel compile jobs,编译时使用最大的并行数。,,Maximum amount of jobs to use when compiling
debugyycwarning,Automatic response to warning when attempting to debug YYC,当使用 YYC 调试时警告,,Preference to turn off the dialog warning the user that this run action will be completed in the VM not YYC
UseDefaultLicenseAgreement,Use Default License Agreement,使用默认许可协议,,Use Default License Agreement
UseDefaultNSISScript,Use Default NSIS Script,使用默认 NSIS 安装脚本,,Use Default NSIS Script
ObjectEditor_DefaultCodeComment,/// @description Insert description here\n// You can write your code in this editor,/// @description 在这里插入描述\n// 你可以在此编辑器中写入代码,Do not translate @description and leave in /// and // at the start of each line,Object editor module default text for new events
ObjectEditor_DefaultEventComment,Default event content,默认事件内容,,Default Code Event Comment to use
ObjectEditor_ShowDefaultHelpPref,Add default event content,是否默认在新的事件中显示默认帮助注释？,,Object editor module default text preference
ObjectEditor_InheritedEventAlpha,Inherited Events Alpha,继承事件Alpha,,object editor ghosted events alpha setting
ObjectEditor_EventFormatPref,Event label format (unchecked items are shown in the tooltip),事件标签格式（未勾选项会在工具提示中显示）,,event label format preference title
EventLabelFormat_Name,Event Name,时间名,,event label format name item
EventLabelFormat_Description,Event Description,事件描述,,event label format description item
EventLabelFormat_ParentObject,Parent Object,父物体,,event label format parent object item
DnD_ReservedTagName,The tag name {0} is reserved and cannot be used.,标签名 {0} 是预留的且不能使用.,,DnDGadget reserved tag name warning
DnD_ReservedTagName_Title,Reserved Tag Name,预留的标签名称,,DnDGadget reserved tag name warning message title
Room_InvalidDepthsImportedLog,Imported layer depths for room(s) '{0}' were not adequately spaced. Unless updated this will have undefined results in game.,没有足够空间容纳导入到房间 '{0}' 的层深度，请更改深度，否则将会在游戏中引发未定义的结果。,,conversion log message where layer depths are invalid and have not been adjusted
Room_InvalidDepthsImportedMessage,Imported layer depths for rooms listed below are not adequately spaced. Do you want to redistribute depths? This may require updating scripts where depth values have been used. \nChoosing 'no' will maintain the user defined depths but will have undefined results in game.,没有足够空间容纳导入到下列房间的层深度。您要重新分配深度吗？这可能需要更新使用深度值的脚本。\n选择“否”将会维持用户定义的深度，但会在游戏中导致未定义的结果。,, message when importing a project which has invalid layer depths
Room_AutoDepthUpdateMessage,"User defined layer depths are not adequately spaced. Do you want to redistribute depths? \nChoosing 'no' will maintain the user defined depths, but will have undefined results in game.",没有足够空间容纳用户定义的层深度。您要重新分配深度吗？\n选择“否”将会维持用户定义的深度，但会在游戏中导致未定义的结果。,,the message when a user tries to put too many layers between their user defined layers such that we can't create unique depths.
Room_AutoDepthUpdateTitle,Layer Depth Error,层深度错误,,message title when the user has given invalid layer depths
roomdefaultstep,Default layer depth spacing,层间深度的间距,,the preference label for auto depth layer spacing
room_autodepthchoice,Automatic response to updating layer depths,默认自动更新层深度,,preference label for the auto depth confirmation dialog preference
DnDConvert_Warning,You are performing a one-way conversion from DnD™ to GameMaker Language. Do you want to continue?,你正在执行一个 DnD™  到 GML的单向转换.你想要继续吗？,,Object editor convert dnd to script warning
DnDConvert_WarningTitle,Convert DnD™,转换 DnD™,,object editor dnd convert warning title
TimelineEditor_ConvertMerge,Merging the selected moments will result in conversion from DnD™ to GameMaker Language. Do you want to continue?,合并选中的时刻点将导致从 DnD™ 转换为 GML.你想要继续吗？,,Merge warning
TimelineDnD_ConvertOpposite,Opposite,相对的,,Convert dnd or script to opposite type
Settings_DnDConvert,Automatic response to DnD™ conversion to GameMaker Language,默认 DnD™ 转换为 GML,,DnD™ convert pref
Settings_DnDDeleteNode,Automatic response to DnD™ node deletion,默认为 DnD™ 节点删除,,DnD™ deletion pref
DnDModule_DeleteNodeMsg,Are you sure you want to delete this DnD™ action?,你确定要删除这个 DnD™ 动作?,,DnD delete message
DnDModule_ConvertToScript,Convert to GML,转换成GML,,DnD™ module convert to gml context menu
dpi_percentage,% of native DPI,% 的本地分辨率（DPI）,,Slider to control percentage of DPI
dpi_raw,Raw DPI value,原DPI值,,Raw value of DPI to override with
DnDModule_ResetLayout,Reset Layout,重置布局,,DnD™ module reset layout context menu
ggs_support_lib,Support Library,支持库,,Support Library
BackgroundLayer_AnimationFPS,Animation Speed:,动画速度:,,The caption for the background layer animation fps property
ListViewExplorer_None,None,无,,None resource
ListViewExplorer_GoBack,Back,返回,,Back item
ListView_Search,Search,查找,,ListView search label
ListViewExplorer_CancelSearch,Cancel,取消,,ListView cancel search label
DnDModule_ApplyToExplorer,Applies To...,应到到...,,Apply to list view explorer title
DnDModule_ApplyTo_Self,Self,自身,,Apply to self caption
DnDModule_ApplyTo_Other,Other,对方,,Apply to other caption
DnDModule_ApplyTo_All,All,所有,,Apply to all caption
DnDModule_ApplyTo_Expression,Expression,表达式,,Apply To expression label
RoomEditor_DockTab,Room Editor,房间编辑器,,The default tab name for a tab created by the room editor
keystore_error,Error with Keystore,密钥错误,,Error with Keystore
keystore_invalid_alias,Invalid characters in alias,别名中的无效字符,,Invalid characters in alias
keystore_invalid_password,Invalid characters in password,密码中的无效字符,,Invalid characters in password
keystore_invalid_commonname,Invalid characters in common name,通用名中有无效字符,,Invalid characters in common name
keystore_invalid_orgunit,Invalid characters in organisational unit,组织单位中有无效字符,,Invalid characters in organisational unit
keystore_invalid_org,Invalid characters in organisation,组织中有无效字符,,Invalid characters in organisation
keystore_invalid_location,Invalid characters in location,位置中有无效字符,,Invalid characters in location
keystore_invalid_country,Invalid characters in country,国家中有无效字符,,Invalid characters in country
keystore_small_pass,Password must be longer than 5 characters,密码必须超过5个字符,,Password must be longer than 5 characters
keystore_jdk_error,JDK not installed correctly at location entered in Android Platform Settings,安卓平台设置中JDK安装位置不正确,,JDK install error
keystore_show_error,Could not process Keystore; may be corrupt or have incorrect password,无法生成Keystore，可能被中途打断或密码不正确,,Keystore error during processing
keystore_small_alias,Alias password must be longer than 5 characters,别名必须超过5个字符,,Alias password must be longer than 5 characters
keystore_invalid_alias_password,Invalid characters in alias password,别名密码中存在非法字符,,Invalid characters in alias password
GMXTextureGroup_BadId,The Texture Group for sprite '{0}' is invalid - setting to Default Texture Group instead,精灵纹理组 '{0}' 无效 - 使用默认纹理组代替,,Error message on importing that a sprite texture group is wrong
ggs_enable_flurry,Enable Flurry Analytics,开启 Flurry 分析,,Enable Flurry Analytics
ggs_enable_google_analytics,Enable Google Analytics,开启谷歌分析,,Enable Google Analytics
ggs_google_analytics_id,Google Analytics ID,谷歌分析 Id,,Google Analytics Id
ggs_flurry_id,Flurry Analytics ID,Flurry 分析 Id,,Flurry Analytics Id
ggs_advertising_type,Advertising Type,广告类型,,Advertising Type
ggs_use_test_ads,Use Test Ads,使用测试广告,,Use Test Ads
ggs_enable_advertising,Enable Advertising,启用广告,,Enable Advertising
ggs_advertising_key0,Key 0,密钥 0,,Key 0
ggs_advertising_key1,Key 1,密钥 1,,Key 1
ggs_advertising_key2,Key 2,密钥 2,,Key 2
ggs_advertising_key3,Key 3,密钥 3,,Key 3
ggs_advertising_key4,Key 4,密钥 4,,Key 4
windowsuwp_package_arm,Package an ARM build,打包一个ARM生成,,Package an ARM build
windowsuwp_package_x86,Package an x86 build,打包一个x86生成,,Package an x86 build
windowsuwp_package_x64,Package an x64 build,打包一个x64生成,,Package an x64 build
win_uwp_package_default_type,Default package architecture,默认包架构,,Win UWP Preference for package architecture
win_uwp_store_package_default_type,Automatic response to creating store package,创建商店包的默认回应,,Default response for creating store package - sits on same dialogue as package_default_type above
windows_package_remember,Remember Packaging Option?,记住打包选项？,,Remember Packaging Option?
windows_package_nsis,Package as Installer,打包为安装程序,,Package as Installer
windows_package_zip,Package as Zip,打包为Zip,,Package as Zip
windows_package_type,Package Type,打包类型,,Package Type
windows_package_default_type,Default packaging type,默认打包类型,,Default Packaging Type
html5_package_loose,Package as Loose Files,以零散文件打包,,Package as Loose Files
html5_package_zip,Package as Zip,打包为Zip,,Package as Zip
html5_package_remember,Remember Packaging Option?,记住打包选项？,,Remember Packaging Option?
html5_package_default_type,Default packaging type,默认打包类型,,Default Packaging Type
ListBoxEnum_HTML5PackageChoice_HTML5Package_LooseFiles,Package as Loose Files,以零散文件打包,,Package as Loose Files
ListBoxEnum_HTML5PackageChoice_HTML5Package_Zip,Package as Zip,打包为Zip,,Package as Zip
ListBoxEnum_HTML5PackageChoice_HTML5Package_Show,Show Dialog,显示对话框,,Show Dialog
windows_uwp_package_upload,Package for Store Upload,打包并向商店上传,,Package for Store Upload
xbox_package_dev,Developer Package,开发程序包,,Normal Package type used during development
